{
  "backup_state": "pending",
  "batch_count": 1,
  "byte_size": 1024,
  "closed_at": "2026-08-12T12:00:00Z",
  "created_at": "2026-08-12T12:00:00Z",
  "event_count": 1,
  "file_hash": "sha256:8888888888888888888888888888888888888888888888888888888888888888",
  "first_commit_hash": "sha256:2222222222222222222222222222222222222222222222222222222222222222",
  "first_event_hash": "sha256:a3aa3d716159905e183ff846c2bcbccb4a48a71a49bbfd772cc65d49f8b0bc94",
  "first_seq": 1,
  "integrity": {
    "algorithm": "sha256",
    "canonicalization": "rfc8785",
    "content_hash": "sha256:63447a6becc18f5114606ecf30116aefa25c4ea5ca09978e4e23d2063476e997",
    "excluded_fields": [
      "integrity.content_hash"
    ]
  },
  "journal_format_version": 1,
  "last_commit_hash": "sha256:2222222222222222222222222222222222222222222222222222222222222222",
  "last_event_hash": "sha256:a3aa3d716159905e183ff846c2bcbccb4a48a71a49bbfd772cc65d49f8b0bc94",
  "last_seq": 1,
  "merkle_root": "sha256:9999999999999999999999999999999999999999999999999999999999999999",
  "previous_manifest_hash": null,
  "schema_version": "1.0.0",
  "segment_id": "seg_01J00000000000000000000001",
  "segment_name": "000001.jsonl",
  "stream": {
    "namespace": "target",
    "run_id": "run_01J00000000000000000000001",
    "stream_id": "str_01J00000000000000000000001",
    "target_identity": {
      "commit": "1111111111111111111111111111111111111111",
      "scope_id": "scp_01J00000000000000000000001",
      "source_tree_hash": "sha256:dddddddddddddddddddddddddddddddddddddddddddddddddddddddddddddddd",
      "target_id": "tgt_01J00000000000000000000001"
    },
    "target_key": "sha256:dddddddddddddddddddddddddddddddddddddddddddddddddddddddddddddddd"
  }
}
